{
  "schemaVersion": 1,
  "version": "1.8.6",
  "build": 25,
  "publishedAt": "2026-10-16T00:00:00Z",
  "forceUpdate": false,
  "locales": {
    "en": {
      "title": "A lighter, faster interface",
      "summary": "Version 1.8.6 introduces a low-cost Minimal design and streamlines navigation and mod details for smoother use on entry-level Android devices.",
      "highlights": [
        "Minimal is available as a low-cost option while Retro Manga remains the default.",
        "The drawer no longer loads SVG artwork or per-item press animations.",
        "Opening mod details no longer stacks page, fade and image transitions."
      ],
      "sections": [
        {
          "heading": "A lightweight option",
          "items": [
            "Minimal uses whitespace and typography instead of neutral cards, with no backdrop painters, skewed controls or decorative shadows.",
            "Retro Manga remains the default; Minimal, Mario 64 and SM64 Intro are available in Settings.",
            "Existing valid theme selections remain unchanged, and missing or unknown selections use Retro Manga.",
            "When no previous choice exists, a one-time banner lets users turn on automatic installation after downloads or keep download-only behavior."
          ]
        },
        {
          "heading": "Faster navigation",
          "items": [
            "Drawer destinations use lightweight Material glyphs for optional themes and text-only rows in Minimal.",
            "SVG UI assets and their rendering dependency have been removed; the header uses one lightweight raster app logo.",
            "Route changes are immediate instead of running a combined scale and fade transition."
          ]
        },
        {
          "heading": "Simpler mod details",
          "items": [
            "The detail screen renders immediately without its previous entrance fade.",
            "Mod images no longer start a Hero animation between catalogue cards and details.",
            "Content, installation actions, favourites and sharing keep their existing behavior."
          ]
        }
      ]
    },
    "es": {
      "title": "Una interfaz más ligera y rápida",
      "summary": "La versión 1.8.6 incorpora un diseño Minimalista de bajo costo y simplifica la navegación y los detalles de mods para funcionar con mayor fluidez en dispositivos Android de gama baja.",
      "highlights": [
        "Minimalista está disponible como opción ligera y Retro Manga permanece como predeterminado.",
        "El drawer ya no carga gráficos SVG ni animaciones de presión por elemento.",
        "Abrir los detalles de un mod ya no encadena transiciones de página, fade e imagen."
      ],
      "sections": [
        {
          "heading": "Una opción ligera",
          "items": [
            "Minimalista usa espacio y tipografía en lugar de tarjetas neutras, sin fondos dibujados, controles inclinados ni sombras decorativas.",
            "Retro Manga permanece como predeterminado; Minimalista, Mario 64 y SM64 Intro están disponibles en Ajustes.",
            "Las selecciones válidas existentes se conservan; una selección ausente o desconocida usa Retro Manga.",
            "Cuando no existe una elección previa, un aviso único permite activar la instalación automática tras las descargas o conservar solo la descarga."
          ]
        },
        {
          "heading": "Navegación más rápida",
          "items": [
            "Los destinos del drawer usan símbolos Material ligeros en los temas opcionales y filas de solo texto en Minimalista.",
            "Se eliminaron los assets SVG y su dependencia; el encabezado utiliza un único logo raster ligero de la app.",
            "Los cambios de ruta son inmediatos en lugar de ejecutar una transición combinada de escala y fade."
          ]
        },
        {
          "heading": "Detalles de mods más simples",
          "items": [
            "La pantalla de detalle se dibuja inmediatamente sin su anterior fade de entrada.",
            "Las imágenes ya no inician una animación Hero entre las tarjetas del catálogo y el detalle.",
            "El contenido, las acciones de instalación, los favoritos y compartir conservan su funcionamiento."
          ]
        }
      ]
    },
    "pt-BR": {
      "title": "Uma interface mais leve e rápida",
      "summary": "A versão 1.8.6 adiciona um visual Minimalista de baixo custo e simplifica a navegação e os detalhes dos mods para maior fluidez em dispositivos Android básicos.",
      "highlights": [
        "Minimalista está disponível como opção leve e Retro Manga continua como padrão.",
        "O drawer não carrega mais imagens SVG nem animações de toque por item.",
        "Abrir os detalhes de um mod não combina mais transições de página, fade e imagem."
      ],
      "sections": [
        {
          "heading": "Uma opção leve",
          "items": [
            "Minimalista usa espaço e tipografia no lugar de cartões neutros, sem fundos desenhados, controles inclinados ou sombras decorativas.",
            "Retro Manga continua como padrão; Minimalista, Mario 64 e SM64 Intro estão disponíveis nos Ajustes.",
            "As seleções válidas existentes são mantidas; uma seleção ausente ou desconhecida usa Retro Manga.",
            "Quando não existe uma escolha anterior, um aviso único permite ativar a instalação automática após os downloads ou manter apenas o download."
          ]
        },
        {
          "heading": "Navegação mais rápida",
          "items": [
            "Os destinos do drawer usam símbolos Material leves nos temas opcionais e linhas somente com texto no Minimalista.",
            "Os assets SVG e sua dependência foram removidos; o cabeçalho usa um único logo raster leve do app.",
            "As mudanças de rota são imediatas em vez de executar uma transição combinada de escala e fade."
          ]
        },
        {
          "heading": "Detalhes de mods mais simples",
          "items": [
            "A tela de detalhes aparece imediatamente sem o fade de entrada anterior.",
            "As imagens não iniciam mais uma animação Hero entre os cards do catálogo e os detalhes.",
            "O conteúdo, as ações de instalação, os favoritos e o compartilhamento mantêm o comportamento existente."
          ]
        }
      ]
    }
  }
}
